{
  "run_id": "RUN-2026-002",
  "status": "waiting_review",
  "current_task": "FOUND-002",
  "attempt": 2,
  "max_attempts": 3,
  "started_at": "2026-09-29T02:32:00Z",
  "updated_at": "2026-09-29T04:07:17Z",
  "last_review": {
    "decision": "rejected",
    "attempt": 1,
    "reviewed_at": "2026-09-29T03:58:57Z"
  }
}
